{
  "$schema": "./novasteelv3.schema.json",
  "schemaVersion": 1,
  "project": "novasteelv3",
  "environment": "novasteelv3-demo",
  "region": "Sweden Central",
  "dataClassification": "SYNTHETIC",
  "syntheticOnly": true,
  "tenantId": "9d94eb6e-d45e-4f05-bc1b-d0bbd2421561",
  "subscriptionId": "3377065c-bf76-4767-a982-32bce4ffb592",
  "capacity": {
    "name": "novasteelv3fabric",
    "resourceGroupName": "rg-novasteelv3-demo-sc",
    "fabricCapacityId": "2cb31264-8f71-47ef-9146-c66d48a1e944",
    "armResourceId": "/subscriptions/3377065c-bf76-4767-a982-32bce4ffb592/resourceGroups/rg-novasteelv3-demo-sc/providers/Microsoft.Fabric/capacities/novasteelv3fabric",
    "sku": "F2"
  },
  "authentication": {
    "mode": "AzureCli",
    "managedIdentityClientId": ""
  },
  "isolation": {
    "workspaceNamePattern": "^NovaSteelV3(-[A-Za-z0-9]+)?$",
    "reservedNamePrefixes": [
      "NS-DEMO-",
      "NS-dev-",
      "NS-test-",
      "NS-prod-",
      "NovaSteel-"
    ],
    "neverModifyExistingWorkspaces": true
  },
  "workspace": {
    "displayName": "NovaSteelV3-Demo",
    "id": "3d9c0b49-5201-4914-8149-06071b529918"
  },
  "items": {
    "eventhouseOperations": {
      "displayName": "evh-novasteelv3-operations",
      "id": "edb908bb-4d3b-4b62-80ad-8937ebe302b4"
    },
    "kqlOperations": {
      "displayName": "kql-ns-operations",
      "id": "7c3ab91a-c8ac-4658-83b5-f500dad946ec"
    },
    "eventstreamTelemetry": {
      "displayName": "es-ns-telemetry-v1",
      "id": "9706234c-cf70-4760-9edc-5f535720058e"
    },
    "landingLakehouse": {
      "displayName": "lh_novasteelv3_landing",
      "id": "f03d1c6b-fad8-4992-819f-f66fc4f01001"
    },
    "coreLakehouse": {
      "displayName": "lh_novasteelv3_core",
      "id": "623b4455-5c28-4235-8138-883d69a5810d"
    },
    "notebookInitialize": {
      "displayName": "v3-initialize-lakehouses",
      "id": "05a68a3a-aff4-4c1a-b2cc-833feabb2f87"
    },
    "notebookLoadReferenceData": {
      "displayName": "v3-load-reference-data",
      "id": "943bcd97-807e-455d-a02c-70c827e00df3"
    },
    "notebookSeedBronzeFromPack": {
      "displayName": "v3-seed-bronze-from-pack",
      "id": "86ec3acd-3dd3-4519-84ab-32eeaf0641a2"
    },
    "notebookLoadOperationalEnvelopes": {
      "displayName": "v3-load-operational-envelopes",
      "id": "f5a9e09c-72c8-48d3-b348-86ed51e18cf0"
    },
    "notebookLoadAnalyticalGold": {
      "displayName": "v3-load-analytical-gold",
      "id": "6a1bc15c-7414-4c8d-a1f0-cb3b31009bec"
    },
    "notebookBronzeToSilver": {
      "displayName": "v3-bronze-to-silver",
      "id": "67b8d7fd-e2cb-42a7-a9a2-80dd6012af3a"
    },
    "notebookSilverToGold": {
      "displayName": "v3-silver-to-gold",
      "id": "fa6dad07-eee7-453a-aa99-f59739402aa8"
    },
    "notebookDemoScoring": {
      "displayName": "v3-deterministic-demo-scoring",
      "id": "6eb73f3d-3aa7-4744-99c3-79a5cf8a3470"
    },
    "notebookDataQuality": {
      "displayName": "v3-validate-data-quality",
      "id": "020eaa92-d5c1-48c7-9518-c861adf7f38f"
    },
    "pipelineMedallion": {
      "displayName": "pl-novasteelv3-medallion",
      "id": "0021f29d-810d-4d6a-87f9-d111e7b187cf"
    },
    "pipelineDemoScoring": {
      "displayName": "pl-novasteelv3-demo-scoring",
      "id": "a568fc62-974a-4f63-bdb0-7bfc83dc29c2"
    },
    "semanticOperations": {
      "displayName": "sm-novasteelv3-operations",
      "id": "6f104805-a4c4-481f-a0ad-d624fccc7ce0"
    },
    "ontologyNotebook": {
      "displayName": "v3-steel-ontology",
      "id": "e57436a3-4070-4b62-8cd5-619a6723589a"
    },
    "dataAgent": {
      "displayName": "da-novasteelv3",
      "id": "8d05f5f4-5e31-4180-90e9-bfa84ba7127d"
    }
  },
  "onelake": {
    "landingTablesUri": "abfss://<novasteelv3-workspace-guid>@onelake.dfs.fabric.microsoft.com/<lh_novasteelv3_landing-guid>/Tables",
    "coreTablesUri": "abfss://<novasteelv3-workspace-guid>@onelake.dfs.fabric.microsoft.com/<lh_novasteelv3_core-guid>/Tables"
  },
  "retention": {
    "telemetryHot": "90.00:00:00",
    "alarmHot": "365.00:00:00",
    "gatewayHealthHot": "30.00:00:00",
    "modelInferenceHot": "90.00:00:00",
    "quarantineHot": "30.00:00:00"
  },
  "bindings": {
    "sensitivityLabelId": "",
    "kqlQueryServiceUri": "https://trd-q10bnypm07cdfv120p.z8.kusto.fabric.microsoft.com",
    "kqlIngestionServiceUri": "https://ingest-trd-q10bnypm07cdfv120p.z8.kusto.fabric.microsoft.com",
    "coreSqlEndpoint": "n3vzjhk62qcu7pa32c55eqqvme-jefzypibkiketakjaydrwuuzda.datawarehouse.fabric.microsoft.com"
  },
  "deploymentOptions": {
    "createOrBindWorkspace": true,
    "assignCapacity": true,
    "deployEventhouseAndKql": true,
    "deployLakehouses": true,
    "deployNotebooks": true,
    "deployPipelines": true,
    "deploySemanticModel": true,
    "semanticModelBindingValidated": true,
    "deployDataAgent": true
  }
}
